{
  "schemaVersion": "1.0",
  "workflowId": "top-skill-2-release-candidate",
  "runId": "2026-05-14-2-0-0-rc",
  "passId": "judicial-initial",
  "role": "judicial",
  "adapterKind": "llm-api",
  "invocationId": "resp_0b25f04948c00976006a067e47bbc081a2a0d6252a45a65f21",
  "contextId": "resp_0b25f04948c00976006a067e47bbc081a2a0d6252a45a65f21-fresh-context",
  "runnerName": "top-protocol-runner",
  "processId": 16944,
  "command": "scripts/adapters/llm_api_adapter.py",
  "startedAt": "2026-05-15T02:00:39Z",
  "endedAt": "2026-05-15T02:00:54Z",
  "exitCode": 0,
  "taskCapsuleRef": "capsules/judicial-initial.task-capsule.json",
  "contextPackageRef": "contexts/judicial-initial.context-package.json",
  "handoffArtifactRef": "handoffs/judicial-initial.handoff.json",
  "contextHash": "34502ed8a19460739c029116cdd48bb277d661515073f6df1461378dc3cc0a18",
  "handoffHash": "690f46d56c9b7be062dd43a056a45189c039d7c55f63b1d53eecf028df29a7fe",
  "freshContext": true,
  "receivedOnlyContextPackage": true,
  "modelInvocationEvidence": true,
  "artifactWrites": [],
  "limitations": [
    "LLM API invocation completed in a fresh request using only context package inputs."
  ]
}
