{
  "schemaVersion": "1.0",
  "workflowId": "top-skill-2-repair-artifact-dogfood",
  "runId": "2026-05-14-repair-artifact-dogfood",
  "passId": "repair-1",
  "role": "repair",
  "adapterKind": "llm-api",
  "invocationId": "resp_04016d5a8b75a44b006a0676847120819eb2db33897442f3cc",
  "contextId": "resp_04016d5a8b75a44b006a0676847120819eb2db33897442f3cc-fresh-context",
  "runnerName": "top-protocol-runner",
  "processId": 6916,
  "command": "scripts/adapters/llm_api_adapter.py",
  "startedAt": "2026-05-15T01:27:32Z",
  "endedAt": "2026-05-15T01:27:40Z",
  "exitCode": 0,
  "taskCapsuleRef": "capsules/repair-1.task-capsule.json",
  "contextPackageRef": "contexts/repair-1.context-package.json",
  "handoffArtifactRef": "handoffs/repair-1.handoff.json",
  "contextHash": "faea45d5bc5251ad3711c362ef28819b18662a4b5ca80d44e5189f50ffc955b2",
  "handoffHash": "e5f2d392ef91e70d61c22947ecfd676893d6cdb1f4904338c5075dea5faed645",
  "freshContext": true,
  "receivedOnlyContextPackage": true,
  "modelInvocationEvidence": true,
  "artifactWrites": [
    {
      "ref": "artifacts/repair-target.json",
      "sha256": "865b9e5ac6befd99eb70be3f88d5c20f794d3d6117bf05c6f904a5928e6c85ca"
    }
  ],
  "limitations": [
    "LLM API invocation completed in a fresh request using only context package inputs."
  ]
}
